[
  {
    "recommendation_id": "rec_f83ae109",
    "tender_id": "tender-001",
    "company_id": "APEX-INFRA-001",
    "recommendation": "BID",
    "qualification_score": 100,
    "competitive_strength": 44,
    "incumbent_risk": 20,
    "execution_risk": 13,
    "value_score": 62,
    "primary_bottleneck": null,
    "bottleneck_category": "all_clear",
    "evidence_gaps": [],
    "confidence": 0.5,
    "reasoning": "Recommendation: BID. Qualification score: 100/100.",
    "failed_mandatory_requirements": [],
    "pipeline_duration_seconds": 0.011,
    "created_at": "2026-06-25T15:12:46Z"
  },
  {
    "recommendation_id": "rec_26f4bead",
    "tender_id": "tender-001",
    "company_id": "APEX-INFRA-001",
    "recommendation": "BID",
    "qualification_score": 100,
    "competitive_strength": 44,
    "incumbent_risk": 20,
    "execution_risk": 13,
    "value_score": 62,
    "primary_bottleneck": null,
    "bottleneck_category": "all_clear",
    "evidence_gaps": [],
    "confidence": 0.5,
    "reasoning": "Recommendation: BID. Qualification score: 100/100.",
    "failed_mandatory_requirements": [],
    "pipeline_duration_seconds": 0.01,
    "created_at": "2026-06-25T15:12:59Z"
  },
  {
    "recommendation_id": "rec_62f459af",
    "tender_id": "tender-001",
    "company_id": "APEX-INFRA-001",
    "recommendation": "NO_BID",
    "qualification_score": 77,
    "competitive_strength": 44,
    "incumbent_risk": 20,
    "execution_risk": 13,
    "value_score": 58,
    "primary_bottleneck": "Experience Requirement Gap",
    "bottleneck_category": "experience_threshold_not_met",
    "evidence_gaps": [],
    "confidence": 0.87,
    "reasoning": "Recommendation: NO_BID. Qualification score: 77/100. Primary issue: Experience Requirement Gap.",
    "failed_mandatory_requirements": [
      "req_a7fb9707"
    ],
    "pipeline_duration_seconds": 0.013,
    "created_at": "2026-06-25T15:16:26Z"
  },
  {
    "recommendation_id": "rec_c22a3062",
    "tender_id": "tender-001",
    "company_id": "APEX-INFRA-001",
    "recommendation": "REVIEW",
    "qualification_score": 100,
    "competitive_strength": 44,
    "incumbent_risk": 45,
    "execution_risk": 13,
    "value_score": 60,
    "primary_bottleneck": "Missing Proof",
    "bottleneck_category": "evidence_gap",
    "evidence_gaps": [
      "Completion certificate for qualifying project not on file"
    ],
    "confidence": 0.98,
    "reasoning": "Recommendation: REVIEW. Qualification score: 100/100. Primary issue: Missing Proof. Evidence gaps: Completion certificate for qualifying project not on file.",
    "failed_mandatory_requirements": [],
    "pipeline_duration_seconds": 0.011,
    "created_at": "2026-06-25T15:19:19Z"
  },
  {
    "recommendation_id": "rec_7d175f51",
    "tender_id": "tender-001",
    "company_id": "APEX-INFRA-001",
    "recommendation": "BID",
    "qualification_score": 100,
    "competitive_strength": 44,
    "incumbent_risk": 45,
    "execution_risk": 13,
    "value_score": 60,
    "primary_bottleneck": null,
    "bottleneck_category": "all_clear",
    "evidence_gaps": [],
    "confidence": 1.0,
    "reasoning": "Recommendation: BID. Qualification score: 100/100.",
    "failed_mandatory_requirements": [],
    "pipeline_duration_seconds": 0.012,
    "created_at": "2026-06-25T15:19:55Z"
  },
  {
    "recommendation_id": "rec_b12243b6",
    "tender_id": "tender-001",
    "company_id": "APEX-INFRA-001",
    "recommendation": "REVIEW",
    "qualification_score": 100,
    "competitive_strength": 44,
    "incumbent_risk": 75,
    "execution_risk": 13,
    "value_score": 58,
    "primary_bottleneck": "Historical Vendor Dominance",
    "bottleneck_category": "incumbent_risk",
    "evidence_gaps": [],
    "confidence": 1.0,
    "reasoning": "Recommendation: REVIEW. Qualification score: 100/100. Primary issue: Historical Vendor Dominance.",
    "failed_mandatory_requirements": [],
    "pipeline_duration_seconds": 0.01,
    "created_at": "2026-06-25T15:20:25Z"
  },
  {
    "recommendation_id": "rec_092b7e4f",
    "tender_id": "tender-001",
    "company_id": "APEX-INFRA-001",
    "recommendation": "REVIEW",
    "qualification_score": 100,
    "competitive_strength": 44,
    "incumbent_risk": 75,
    "execution_risk": 13,
    "value_score": 58,
    "primary_bottleneck": "Historical Vendor Dominance",
    "evidence_gaps": [],
    "confidence": 1.0,
    "confidence_reason": [
      "4 of 4 requirements have a definitive status"
    ],
    "reasoning": "Recommendation: REVIEW. Qualification score: 100/100. Primary issue: Historical Vendor Dominance.",
    "failed_mandatory_requirements": [],
    "pipeline_duration_seconds": 0.011,
    "created_at": "2026-06-25T15:34:00Z"
  },
  {
    "recommendation_id": "rec_6bd534cc",
    "tender_id": "tender-001",
    "company_id": "APEX-INFRA-001",
    "recommendation": "REVIEW",
    "qualification_score": 100,
    "competitive_strength": 44,
    "incumbent_risk": 75,
    "execution_risk": 13,
    "value_score": 58,
    "primary_bottleneck": "Historical Vendor Dominance",
    "evidence_gaps": [],
    "confidence": 1.0,
    "confidence_reason": [
      "4 of 4 requirements have a definitive status"
    ],
    "reasoning": "Recommendation: REVIEW. Qualification score: 100/100. Primary issue: Historical Vendor Dominance.",
    "failed_mandatory_requirements": [],
    "pipeline_duration_seconds": 0.011,
    "created_at": "2026-06-25T15:34:28Z"
  },
  {
    "recommendation_id": "rec_00f7f634",
    "tender_id": "tender-001",
    "company_id": "APEX-INFRA-001",
    "recommendation": "REVIEW",
    "qualification_score": 100,
    "competitive_strength": 44,
    "incumbent_risk": 75,
    "execution_risk": 13,
    "value_score": 58,
    "primary_bottleneck": "Historical Vendor Dominance",
    "evidence_gaps": [],
    "confidence": 1.0,
    "confidence_reason": [
      "4 of 4 mandatory requirements verified",
      "Incumbent risk score (75) exceeds threshold — prior vendor advantage inferred from tender language"
    ],
    "reasoning": "Recommendation: REVIEW. Qualification score: 100/100. Primary issue: Historical Vendor Dominance.",
    "failed_mandatory_requirements": [],
    "pipeline_duration_seconds": 0.011,
    "created_at": "2026-06-25T15:36:09Z"
  },
  {
    "recommendation_id": "rec_65a7d1f6",
    "tender_id": "tender-001",
    "company_id": "APEX-INFRA-001",
    "recommendation": "REVIEW",
    "qualification_score": 100,
    "competitive_strength": 44,
    "incumbent_risk": 75,
    "execution_risk": 13,
    "value_score": 58,
    "primary_bottleneck": "Historical Vendor Dominance",
    "evidence_gaps": [],
    "confidence": 1.0,
    "confidence_reason": [
      "4 of 4 mandatory requirements verified",
      "Incumbent risk score (75) exceeds threshold — prior vendor advantage inferred from tender language"
    ],
    "reasoning": "Recommendation: REVIEW. Qualification score: 100/100. Primary issue: Historical Vendor Dominance.",
    "failed_mandatory_requirements": [],
    "pipeline_duration_seconds": 0.011,
    "created_at": "2026-06-25T15:36:24Z"
  },
  {
    "recommendation_id": "rec_50e7a87e",
    "tender_id": "tender-001",
    "company_id": "APEX-INFRA-001",
    "recommendation": "REVIEW",
    "qualification_score": 100,
    "competitive_strength": 44,
    "incumbent_risk": 75,
    "execution_risk": 13,
    "value_score": 58,
    "primary_bottleneck": "Historical Vendor Dominance",
    "evidence_gaps": [],
    "confidence": 1.0,
    "confidence_reason": [
      "4 of 4 mandatory requirements verified",
      "Incumbent risk score (75) exceeds threshold — prior vendor advantage inferred from tender language"
    ],
    "reasoning": "Recommendation: REVIEW. Qualification score: 100/100. Primary issue: Historical Vendor Dominance.",
    "failed_mandatory_requirements": [],
    "pipeline_duration_seconds": 0.012,
    "created_at": "2026-06-25T15:37:11Z"
  },
  {
    "recommendation_id": "rec_57ca6f38",
    "tender_id": "tender-001",
    "company_id": "APEX-INFRA-001",
    "recommendation": "REVIEW",
    "qualification_score": 100,
    "competitive_strength": 44,
    "incumbent_risk": 75,
    "execution_risk": 13,
    "value_score": 58,
    "primary_bottleneck": "Historical Vendor Dominance",
    "evidence_gaps": [],
    "extraction_warnings": [
      "Offline mode: regex extraction only — LLM extraction disabled"
    ],
    "confidence": 1.0,
    "confidence_reason": [
      "4 of 4 mandatory requirements verified",
      "Incumbent risk score (75) exceeds threshold — prior vendor advantage inferred from tender language"
    ],
    "reasoning": "Recommendation: REVIEW. Qualification score: 100/100. Primary issue: Historical Vendor Dominance.",
    "failed_mandatory_requirements": [],
    "pipeline_duration_seconds": 0.01,
    "created_at": "2026-06-25T16:06:00Z"
  }
]